keyword,total_frequency,matched_synonyms,matched_metric,similarity
carbon intensity,2,carbon footprint (1); carbon emissions (1),"Absolute emissions by scope (Scope 1, Scope 2, Scope 3 if applicable)",90.0
water stress,7,water stress (7),Water consumption intensity,95.0
quality assurance,2,quality assurance (1); quality control (1),"Absolute emissions by scope (Scope 1, Scope 2, Scope 3 if applicable)",54.0
risk assessment,2,risk evaluation (1); risk analysis (1),Total water consumption,57.0
legal action,3,litigation (3),"Total volume of hazardous or toxic substances emitted (solid, liquid, gas)",53.84615384615385
